{
  "schema_version": "1.1",
  "space": "2d",
  "domain": "mechanical",
  "source_sha256": "a44c169d66fb4428d47157ebb5f1ed12e35b47fa0da465d0f91d6c7ebb471a5d",
  "review_policy": {
    "reviewOnly": true,
    "accepted": false,
    "ruleEnabled": false,
    "domainGated": true
  },
  "semantic_document": {
    "schema_version": "1.0",
    "document": {
      "id": "MW_DWG_GA001_A",
      "name": "Magic wand mechanical general arrangement review drawing",
      "space": "2d",
      "domain": "mechanical",
      "units": "mm",
      "origin": [
        0.0,
        0.0
      ],
      "tolerance": 0.001,
      "source_sha256": "a44c169d66fb4428d47157ebb5f1ed12e35b47fa0da465d0f91d6c7ebb471a5d",
      "locks": [
        "review_only_prototype",
        "critical_dimensions_require_inspection"
      ],
      "review_policy": {
        "reviewOnly": true,
        "accepted": false,
        "ruleEnabled": false,
        "domainGated": true
      }
    },
    "domain_profile": {
      "id": "mechanical",
      "label": "机械零件与装配",
      "dimensions": [
        "2d",
        "3d"
      ],
      "object_roles": [
        "datum",
        "outline",
        "hole",
        "shaft",
        "boss",
        "pocket",
        "interface",
        "fastener"
      ],
      "review_groups": [
        "datums",
        "degrees_of_freedom",
        "fit",
        "wall_thickness",
        "interference",
        "tolerance"
      ],
      "built_in": true,
      "maturity": "constrained",
      "specialist_generation_blocked": false,
      "production_release_blocked": true
    },
    "objects": [
      {
        "id": "G1",
        "kind": "line",
        "space": "2d",
        "purpose": "grip envelope lower edge",
        "reasoning": "Starts the closed typed outline from a controlled datum.",
        "depends_on": [],
        "anchor": [
          0.0,
          0.0
        ],
        "parameters": {
          "start": [
            0.0,
            0.0
          ],
          "end": [
            115.0,
            0.0
          ],
          "length": 115.0,
          "direction": [
            1.0,
            0.0
          ]
        },
        "source": {
          "plan_space": "2d",
          "object_id": "G1",
          "sequence": 1,
          "cad_layer": "OUTLINE"
        },
        "roles": [
          "outline"
        ],
        "editable": true
      },
      {
        "id": "G2",
        "kind": "line",
        "space": "2d",
        "purpose": "grip envelope far edge",
        "reasoning": "Continues from the preceding endpoint and fixes the transverse extent.",
        "depends_on": [
          "G1"
        ],
        "anchor": [
          115.0,
          0.0
        ],
        "parameters": {
          "start": [
            115.0,
            0.0
          ],
          "end": [
            115.0,
            27.0
          ],
          "length": 27.0,
          "direction": [
            0.0,
            1.0
          ]
        },
        "source": {
          "plan_space": "2d",
          "object_id": "G2",
          "sequence": 2,
          "cad_layer": "OUTLINE"
        },
        "roles": [
          "outline"
        ],
        "editable": true
      },
      {
        "id": "G3",
        "kind": "line",
        "space": "2d",
        "purpose": "grip envelope upper edge",
        "reasoning": "Returns parallel to the first edge with the same exact length.",
        "depends_on": [
          "G2"
        ],
        "anchor": [
          115.0,
          27.0
        ],
        "parameters": {
          "start": [
            115.0,
            27.0
          ],
          "end": [
            0.0,
            27.0
          ],
          "length": 115.0,
          "direction": [
            -1.0,
            0.0
          ]
        },
        "source": {
          "plan_space": "2d",
          "object_id": "G3",
          "sequence": 3,
          "cad_layer": "OUTLINE"
        },
        "roles": [
          "outline"
        ],
        "editable": true
      },
      {
        "id": "G4",
        "kind": "line",
        "space": "2d",
        "purpose": "grip envelope closing edge",
        "reasoning": "Closes the outline at the controlled start point.",
        "depends_on": [
          "G3"
        ],
        "anchor": [
          0.0,
          27.0
        ],
        "parameters": {
          "start": [
            0.0,
            27.0
          ],
          "end": [
            0.0,
            0.0
          ],
          "length": 27.0,
          "direction": [
            0.0,
            -1.0
          ]
        },
        "source": {
          "plan_space": "2d",
          "object_id": "G4",
          "sequence": 4,
          "cad_layer": "OUTLINE"
        },
        "roles": [
          "outline"
        ],
        "editable": true
      },
      {
        "id": "T1",
        "kind": "line",
        "space": "2d",
        "purpose": "Show the transition lower edge.",
        "reasoning": "The explicit origin-relative start and exact endpoint make this connector edge deterministic.",
        "depends_on": [],
        "anchor": [
          115.0,
          0.0
        ],
        "parameters": {
          "start": [
            115.0,
            0.0
          ],
          "end": [
            125.0,
            0.0
          ],
          "length": 10.0,
          "direction": [
            1.0,
            0.0
          ]
        },
        "source": {
          "plan_space": "2d",
          "object_id": "T1",
          "sequence": 5,
          "cad_layer": "SHAFT"
        },
        "roles": [
          "shaft"
        ],
        "editable": true
      },
      {
        "id": "T2",
        "kind": "line",
        "space": "2d",
        "purpose": "Show the transition far edge.",
        "reasoning": "The explicit origin-relative start and exact endpoint make this connector edge deterministic.",
        "depends_on": [],
        "anchor": [
          125.0,
          0.0
        ],
        "parameters": {
          "start": [
            125.0,
            0.0
          ],
          "end": [
            125.0,
            27.0
          ],
          "length": 27.0,
          "direction": [
            0.0,
            1.0
          ]
        },
        "source": {
          "plan_space": "2d",
          "object_id": "T2",
          "sequence": 6,
          "cad_layer": "SHAFT"
        },
        "roles": [
          "shaft"
        ],
        "editable": true
      },
      {
        "id": "T3",
        "kind": "line",
        "space": "2d",
        "purpose": "Show the transition upper edge.",
        "reasoning": "The explicit origin-relative start and exact endpoint make this connector edge deterministic.",
        "depends_on": [],
        "anchor": [
          125.0,
          27.0
        ],
        "parameters": {
          "start": [
            125.0,
            27.0
          ],
          "end": [
            115.0,
            27.0
          ],
          "length": 10.0,
          "direction": [
            -1.0,
            0.0
          ]
        },
        "source": {
          "plan_space": "2d",
          "object_id": "T3",
          "sequence": 7,
          "cad_layer": "SHAFT"
        },
        "roles": [
          "shaft"
        ],
        "editable": true
      },
      {
        "id": "R1",
        "kind": "line",
        "space": "2d",
        "purpose": "Show the lower exposed GFRP rod edge.",
        "reasoning": "The explicit origin-relative start and exact endpoint make this rod edge deterministic.",
        "depends_on": [],
        "anchor": [
          125.0,
          10.0
        ],
        "parameters": {
          "start": [
            125.0,
            10.0
          ],
          "end": [
            315.0,
            10.0
          ],
          "length": 190.0,
          "direction": [
            1.0,
            0.0
          ]
        },
        "source": {
          "plan_space": "2d",
          "object_id": "R1",
          "sequence": 8,
          "cad_layer": "SHAFT"
        },
        "roles": [
          "shaft"
        ],
        "editable": true
      },
      {
        "id": "R2",
        "kind": "line",
        "space": "2d",
        "purpose": "Close the rod tip envelope.",
        "reasoning": "The explicit origin-relative start and exact endpoint make this rod tip deterministic.",
        "depends_on": [],
        "anchor": [
          315.0,
          10.0
        ],
        "parameters": {
          "start": [
            315.0,
            10.0
          ],
          "end": [
            315.0,
            17.0
          ],
          "length": 7.0,
          "direction": [
            0.0,
            1.0
          ]
        },
        "source": {
          "plan_space": "2d",
          "object_id": "R2",
          "sequence": 9,
          "cad_layer": "SHAFT"
        },
        "roles": [
          "shaft"
        ],
        "editable": true
      },
      {
        "id": "R3",
        "kind": "line",
        "space": "2d",
        "purpose": "Show the upper exposed GFRP rod edge.",
        "reasoning": "The explicit origin-relative start and exact endpoint make this rod edge deterministic.",
        "depends_on": [],
        "anchor": [
          315.0,
          17.0
        ],
        "parameters": {
          "start": [
            315.0,
            17.0
          ],
          "end": [
            125.0,
            17.0
          ],
          "length": 190.0,
          "direction": [
            -1.0,